{
  "type": "product-fix",
  "requires_iaa": true,
  "requires_ecap": true,
  "governing_issue": "#1233",
  "scope_summary": "Bounded A2-R repair: normalize runtime-side UTC datetime import lines across the approved allowlist only. No tests, Optional, workflow, dependency, or infrastructure changes.",
  "created_by": "api-builder",
  "created_at": "2026-08-06T11:48:08Z",
  "execution_model": "foreman-orchestrated",
  "orchestrating_agent": "foreman-v2-agent",
  "implementing_agent": "api-builder"
}